Suthran,"Well-organized, methodical; a person who is systematic and efficient in their approach.",India,M
Suthran,"Similar to the previous meaning, well-organized, methodical; a person who is systematic and efficient in their approach.",India,M
Suveen,"Beautiful, graceful; a person with an elegant and refined demeanor.",India,M
Swaranarubini,"Golden beauty, radiant and graceful.",India,F
Swasthika,A symbol of auspiciousness and well-being.,India,F
Sweatha,"Pure, innocent, untainted by worldly concerns.",India,F
Tasvanth,Lord of wealth; a divine figure associated with prosperity and abundance.,India,M
Taswin,"Creative, innovative; someone who has original ideas and is inventive.",India,M
Tejasvin,"Radiant, full of energy; someone who shines brightly with brilliance and vitality.",India,M
Thaksith,"Hardworking, industrious; a person who is diligent and committed to their work.",India,M
Thalir Mithran ,"Thalir is a ""Budding friend"" - a combination of Tamil and Sanskrit and Mithran is other name of god Murugar",India,M
Thasvik,"Radiant, brilliant; someone who shines with brightness and positivity.",India,M
Theeran,"Brave, courageous; a person who faces challenges with strength and valor.",India,M
Thishiyan,"Wise, learned; someone who possesses great knowledge and understanding.",India,M
Trivikram,One who has crossed three worlds; a divine figure who encompasses the universe.,India,M
Tulsi,"Holy basil, sacred plant",India,F
Udaykiran,Rising sun; a person who brings light and warmth into others' lives.,India,M
Udeep,"Rising, ascendant; someone who is on the path to success and prominence.",India,M
Ugrasen,Mighty ruler; a powerful and authoritative leader.,India,M
Urmilan,Encompassing waves; a person who has a broad and far-reaching impact.,India,M
Vagini,"Melodious and enchanting, like a captivating voice.",India,F
Vaishnav,Devotee of Lord Vishnu; someone who is devoted to the worship and service of Lord Vishnu.,India,M
Vajin,"Swift, fast; someone who is quick and agile in their actions",India,M
Vajresh,"Thunderbolt, powerful; a force to be reckoned with, unstoppable.",India,M
Vamsi,Flute of Lord Krishna; a musical instrument associated with divinity and melody.,India,M
Varshini,"Like rain, symbolizing abundance and blessings.",India,F
Vibin,"Full of life, lively; someone who is energetic and vibrant.",India,M
Vibu,"Supreme, omnipresent; a person who is all-encompassing and widespread.",India,M
Vidhya,"Knowledgeable, wise, possessing intellectual prowess.",India,F
Vidul,"Full of knowledge, wise; someone who possesses deep understanding and intelligence",India,M
Vidul,"Full of knowledge, wise; someone who possesses deep understanding and intelligence.",India,M
Vignesh,Other name of god Ganesh,India,M
Vihaan,"Dawn, morning; a person who brings new beginnings and hope.",India,M
Vijay,"This name symbolizes victory, triumph, and success.",India,M
Vikash,"Progress, development; someone who is constantly growing and evolving.",India,M
Vilas,"Play, charm; a person who exudes grace and has an enchanting presence.",India,M
Vinay,"Modesty, humility; someone who displays grace and humility.",India,M
Vinay,"Modesty, humility; someone who displays grace and humility in their demeanor.",India,M
Vineeth,"Humble, modest; someone who displays humility and gentleness in their behavior.",India,M
Vinith,"Knowledgeable, wise; a person who possesses wisdom and understanding.",India,M
Vinu,"Modest, simple; someone who is unassuming and down-to-earth in nature.",India,M
Vishinu,"Infinite and omnipresent, encompassing everything.",India,M
Vishva,"Universe, world; a person who encompasses all existence.",India,M
Vithun,"Reflects multiplication or increase, a growing force.",India,M
Viyash,"Glorious, illustrious; someone who shines with excellence and brilliance.",India,M
Wen,Cultured; Literate,China,M
Xian,Present; Elegant; Virtuous; Admire,China,X
Xiao,"Dreary, mournful; Dawn; Young; Little",China,X
Yadav,"Descendant of Yadu; a person belonging to the Yadu dynasty, often associated with Lord Krishna.",India,M
Yadvik,"Knowledgeable, wise; someone who possesses deep understanding and insight.",India,M
Yagnesh,"Knowledgeable, wise; someone who possesses deep understanding and insight.",India,M
Yakshith,"Permanent, stable; someone who is steadfast and enduring.",India,M
Yan,Beautiful,China,F
Yash,"Fame, glory; someone who achieves recognition and admiration.",India,M
Yashvanth,"Victorious, triumphant; a person who conquers challenges and obstacles.",India,M
Yashvin,"Glorious, victorious; someone who achieves fame and success.",India,M
Yaswanth,"Eternal, everlasting, standing the test of time.",India,M
Yee,"Countryside; Plum; Happy, joy; Harmony",China,F
Yegan,"Unique, incomparable; a person who stands out due to their exceptional qualities.",India,M
Yeman,"Affectionate, loving; someone who is kind-hearted and caring.",India,M
Ying,Answer; Clever; Brave,China,X
Yugan,"Youthful, energetic, vibrant in spirit.",India,M
Yugender,God of the era; a divine figure associated with the current age or epoch.,India,M
Yuvansh,"Youthful, young; someone who embodies youthfulness and vitality.",India,M
Zhan,"Valuable, Genuine, Innocent; Deep",China,X